{
  "object_type": "relia.command_result",
  "schema_version": "1.0",
  "command": "ingest",
  "status": "error",
  "mode": "ingest",
  "exit_code": 3,
  "warnings": [],
  "errors": [
    {
      "type": "outcome_observability_failure",
      "message": "strict attribution could not classify the outcome source",
      "exit_code": 3,
      "evidence_refs": [
        "docs/product/prd.md#exit-codes"
      ],
      "metadata": {
        "exit_meaning": "outcome observability or attribution failure in strict mode"
      }
    }
  ],
  "artifacts": [],
  "evidence_refs": [
    "docs/product/prd.md#exit-codes"
  ],
  "duration_ms": 0,
  "redaction_status": "not_applicable",
  "metadata": {
    "exit_meaning": "outcome observability or attribution failure in strict mode"
  }
}
