{
  "object_type": "relia.command_result",
  "schema_version": "1.0",
  "command": "ingest",
  "status": "error",
  "mode": "ingest",
  "exit_code": 7,
  "warnings": [],
  "errors": [
    {
      "type": "credential_auth_error",
      "message": "required credential or authenticated environment was unavailable",
      "exit_code": 7,
      "evidence_refs": [
        "docs/product/prd.md#exit-codes"
      ],
      "metadata": {
        "exit_meaning": "credential, auth, or environment error"
      }
    }
  ],
  "artifacts": [],
  "evidence_refs": [
    "docs/product/prd.md#exit-codes"
  ],
  "duration_ms": 0,
  "redaction_status": "not_applicable",
  "metadata": {
    "exit_meaning": "credential, auth, or environment error"
  }
}
